"id","name","full_name","owner_id","html_url","description","homepage","language","stargazers_count","watchers_count","forks_count","open_issues_count","score","license_key","license_name","readme_size","readme_has_images","readme_has_icons","year"
180862912,"ENV872BadgerThermoclines","keithbollt/ENV872BadgerThermoclines",46606471,"https://github.com/keithbollt/ENV872BadgerThermoclines","This project examines the change in thermocline depth in nine Wisconsin lakes. It is for a final project for ENVIRON 872, taught by Professor Kateri Salk, Spring 2019.",NULL,"TeX",0,0,0,0,1,"gpl-3.0","GNU General Public License v3.0",195,0,0,2019
165928114,"EnviroNoveltyWI","kdburke/EnviroNoveltyWI",8505843,"https://github.com/kdburke/EnviroNoveltyWI","Assess agricultural land use, forest composition, and climatic causes of environmental novelty in Wisconsin over the past century",NULL,"HTML",0,0,0,0,1,"mit","MIT License",3224,0,0,2019
510549328,"es-950-lake-quality","kathrynrbernard/es-950-lake-quality",41444234,"https://github.com/kathrynrbernard/es-950-lake-quality","Group project for ES 950 to analyze data from the DNR on Wisconsin lake quality.",NULL,"R",0,0,0,0,1,NULL,NULL,7770,0,0,2022
376369927,"Estimate-the-unit-sales-of-Walmart-retail-goods","tinajs2018/Estimate-the-unit-sales-of-Walmart-retail-goods",64679787,"https://github.com/tinajs2018/Estimate-the-unit-sales-of-Walmart-retail-goods","Note: This is one of the two complementary competitions that together comprise the M5 forecasting challenge. Can you estimate, as precisely as possible, the point forecasts of the unit sales of various products sold in the USA by Walmart? If you are interested in estimating the uncertainty distribution of the realized values of the same series, be sure to check out its companion competition  How much camping gear will one store sell each month in a year? To the uninitiated, calculating sales at this level may seem as difficult as predicting the weather. Both types of forecasting rely on science and historical data. While a wrong weather forecast may result in you carrying around an umbrella on a sunny day, inaccurate business forecasts could result in actual or opportunity losses. In this competition, in addition to traditional forecasting methods youre also challenged to use machine learning to improve forecast accuracy.  The Makridakis Open Forecasting Center (MOFC) at the University of Nicosia conducts cutting-edge forecasting research and provides business forecast training. It helps companies achieve accurate predictions, estimate the levels of uncertainty, avoiding costly mistakes, and apply best forecasting practices. The MOFC is well known for its Makridakis Competitions, the first of which ran in the 1980s.  In this competition, the fifth iteration, you will use hierarchical sales data from Walmart, the worlds largest company by revenue, to forecast daily sales for the next 28 days. The data, covers stores in three US States (California, Texas, and Wisconsin) and includes item level, department, product categories, and store details. In addition, it has explanatory variables such as price, promotions, day of the week, and special events. Together, this robust dataset can be used to improve forecasting accuracy.  If successful, your work will continue to advance the theory and practice of forecasting. The methods used can be applied in various business areas, such as setting up appropriate inventory or service levels. Through its business support and training, the MOFC will help distribute the tools and knowledge so others can achieve more accurate and better calibrated forecasts, reduce waste and be able to appreciate uncertainty and its risk implication",NULL,"Jupyter Notebook",0,0,0,0,1,NULL,NULL,NULL,0,0,2021
574886404,"Everybody-Knows-Your-Name","Votiaw09/Everybody-Knows-Your-Name",116119507,"https://github.com/Votiaw09/Everybody-Knows-Your-Name","An analysis of iconography of LGBT bars in Northeast Wisconsin.",NULL,NULL,0,0,0,0,1,NULL,NULL,13076,1,1,2022
161240426,"Example_Code_Base","austcl24/Example_Code_Base",28901711,"https://github.com/austcl24/Example_Code_Base","Examples of my code, classwork and projects from the University of Wisconsin MS-Data Science program as well as from exploration on other subjects of interest...",NULL,"HTML",0,0,0,0,1,NULL,NULL,130,0,0,2018
156125990,"Experimento_svm_sklearn","JessicaIta/Experimento_svm_sklearn",13523699,"https://github.com/JessicaIta/Experimento_svm_sklearn","Repositrio com a aplicao do algoritmo svm do Sklearn na base de dados Wisconsin Breast Cancer",NULL,"Jupyter Notebook",1,1,0,0,1,NULL,NULL,291,0,0,2018
520335930,"Exploratory-Data-Analysis-with-Seaborn","jadiazm/Exploratory-Data-Analysis-with-Seaborn",88745972,"https://github.com/jadiazm/Exploratory-Data-Analysis-with-Seaborn","Producing Statistical Data Visualizations from the Breast Cancer Wisconsin (Diagnostic) Data set.",NULL,"Jupyter Notebook",0,0,0,0,1,NULL,NULL,139,0,0,2022
287958706,"Exploratory-Data-Analysis-with-Seaborn","Hevenicio/Exploratory-Data-Analysis-with-Seaborn",65929471,"https://github.com/Hevenicio/Exploratory-Data-Analysis-with-Seaborn","Using the statistical data visualization library, Seaborn, to discover and explore the relationships in the Wisconsin breast cancer data set (diagnosis). [Project done on Coursera Project Network]",NULL,"Jupyter Notebook",1,1,0,0,1,"mit","MIT License",1117,1,0,2020
505226962,"ExploratoryDataAnalysis","bhavya-kashyap/ExploratoryDataAnalysis",47695886,"https://github.com/bhavya-kashyap/ExploratoryDataAnalysis","Exploratory data analysis using seaborn on breast cancer dataset from University of Wisconsin",NULL,"Jupyter Notebook",0,0,0,0,1,NULL,NULL,NULL,0,0,2022
13506289,"ExternalSort","AbdelrahmanNabil/ExternalSort",5666208,"https://github.com/AbdelrahmanNabil/ExternalSort","External Sorting (Wisconsin`s minibase project)",NULL,"Java",0,0,0,0,1,NULL,NULL,NULL,0,0,2013
246103695,"Fallen-Soldiers-Wisconsin","rayphaistos1/Fallen-Soldiers-Wisconsin",26485618,"https://github.com/rayphaistos1/Fallen-Soldiers-Wisconsin","Visualization showing the frequency and hometowns of record by County for Fallen Service members from Iraq (OIF) and Afghanistan (OEF) Wars",NULL,NULL,0,0,1,0,1,NULL,NULL,2844,0,0,2020
471107458,"fantasymap_group-main","jamdewalt/fantasymap_group-main",98490986,"https://github.com/jamdewalt/fantasymap_group-main","This repository contains the Final Project for the Fantasy Mapping group. This was created for the GEOG575: Interactive Cartography & Geovisualization course at the University of Wisconsin-Madison.",NULL,"JavaScript",0,0,0,5,1,NULL,NULL,7110,1,0,2022
4628439,"FDLwindturbines","publicGIS/FDLwindturbines",1839545,"https://github.com/publicGIS/FDLwindturbines","map of the wind turbines in Fond du Lac county Wisconsin, with various setback limits.",NULL,NULL,1,1,0,0,1,NULL,NULL,119,0,0,2012
301867791,"Feature-and-Architecture-Study-for-Speech-Activity-Detection-using-DNN","MeitalRann/Feature-and-Architecture-Study-for-Speech-Activity-Detection-using-DNN",54916902,"https://github.com/MeitalRann/Feature-and-Architecture-Study-for-Speech-Activity-Detection-using-DNN","This toolkit provides the code used in a Master`s thesis (Feature and Architecture Study for Speech Activity Detection using Deep Neural Networks) at the University of Wisconsin-Madison, department of Electrical and Computer Engineering.",NULL,"MATLAB",3,3,1,0,1,"mit","MIT License",4985,0,0,2020
648987055,"Feature-Selection-and-Data-Visualization","Akcanbasri/Feature-Selection-and-Data-Visualization",77155291,"https://github.com/Akcanbasri/Feature-Selection-and-Data-Visualization","Feature Selection and Data Visualization with breast-cancer-wisconsin-dataset",NULL,"Jupyter Notebook",0,0,0,0,1,NULL,NULL,NULL,0,0,2023
751631814,"Features-Selection","danielamadori98/Features-Selection",95179217,"https://github.com/danielamadori98/Features-Selection","Feature selection techniques to enhance model performance on the ""Breast Cancer Wisconsin (Diagnostic)"" dataset",NULL,"Jupyter Notebook",0,0,0,0,1,"mit","MIT License",3796,0,0,2024
767509572,"FedPriv","abby1712/FedPriv",72368959,"https://github.com/abby1712/FedPriv","Hospitals share PII data daily, risking cybersecurity threats. Our federated learning framework, using Wisconsin data, addresses challenges with SMOTE, isolation forests, and Catboost, achieving 99.95% accuracy on edge devices and 98% on the central server.",NULL,"Jupyter Notebook",0,0,0,0,1,NULL,NULL,1266,0,0,2024
106004101,"feed-forward-neural-network","AFAgarap/feed-forward-neural-network",11130276,"https://github.com/AFAgarap/feed-forward-neural-network","An implementation of the Multilayer Perceptron for breast cancer detection using the Wisconsin diagnostic dataset.",NULL,"Python",8,8,4,2,1,"gpl-3.0","GNU General Public License v3.0",8121,1,1,2017
489261305,"fictional-octo-carnival","ChandniSneha/fictional-octo-carnival",105042218,"https://github.com/ChandniSneha/fictional-octo-carnival","The Dubliners of American Gothicthats how Stephen King referred to Ray Bradburys first book, the little-known 1947 short-story collection, Dark Carnival. Theres good reason few readers, even those well versed in Bradburys work, are unfamiliar with Dark Carnival: Arkham House, a small press out of Sauk City, Wisconsin, published the book in a modest run of 3,112 copies; the book went out of print just a few years later. Besides a pricey limited-edition reprint in 2001, Dark Carnival exists as a literary apparition.  And yet many people have read some of Dark Carnival without knowing it. In 1955, Ballantine Books published the now-classic collection of Bradburys gothic horror, The October Country, which celebrated its sixtieth anniversary on October 25, and many of the stories in the collection are reworkings of tales from Dark Carnival. When given the chance to rerelease the out-of-print collection in 1955, Bradbury seized the opportunity to revisit his first book and correct the things he deemed inadequate. (Ever the perfectionist, Bradbury was, throughout his career, often discontent with calling a book done, even after its publication.) He rewrote a number of stories, made light revisions on others, cut twelve tales altogether, and added four new ones to round out the collection. The stories Bradbury discarded he thought too weak, too violent, or too primitive, and not representative of where he was as a writer at that moment.",NULL,NULL,0,0,0,0,1,NULL,NULL,NULL,0,0,2022
392819716,"Fidelity-of-Quantum-Teleporation","KnightShuffler/Fidelity-of-Quantum-Teleporation",19386881,"https://github.com/KnightShuffler/Fidelity-of-Quantum-Teleporation","This is a repository for my final writeup for Physics 707 - Quantum Computing Lab, at University of Wisconsin-Madison as part of the MS Physics Quantum Computing Program (2020-2021).",NULL,"Jupyter Notebook",0,0,1,0,1,NULL,NULL,NULL,0,0,2021
329588485,"FightAgainstCancer","debajyoti94/FightAgainstCancer",12693105,"https://github.com/debajyoti94/FightAgainstCancer","Building a predictive model to identify which patient has malignant or benign cancerous cells. Using the Wisconsin Diagnostic Breast Cancer (WDBC) from UCI repository.",NULL,"Jupyter Notebook",0,0,0,0,1,NULL,NULL,1919,0,0,2021
336067575,"Final-Project","Breast-Cancer-Team/Final-Project",78564148,"https://github.com/Breast-Cancer-Team/Final-Project","https://www.kaggle.com/uciml/breast-cancer-wisconsin-data",NULL,"Jupyter Notebook",0,0,1,2,1,"mit","MIT License",3725,0,1,2021
604522627,"Financial-Analysis-with-SQL-and-R","mariorope/Financial-Analysis-with-SQL-and-R",44076648,"https://github.com/mariorope/Financial-Analysis-with-SQL-and-R","In this project, it was used data from a national hospital cost survey conducted by the US Agency for Healthcare that consists of hospital records of inpatient samples. The data provided are restricted to the city of Wisconsin and refer to patients aged 0 to 17 years.",NULL,"R",0,0,0,0,1,"mit","MIT License",2266,0,0,2023
226767099,"Firehouse-0ptimus-Battleground-December-2019","optimus-forecasting-and-polling/Firehouse-0ptimus-Battleground-December-2019",53236856,"https://github.com/optimus-forecasting-and-polling/Firehouse-0ptimus-Battleground-December-2019","Michigan, Pennsylvania, and Wisconsin Battleground Poll Conducted in December 2019",NULL,NULL,1,1,0,0,1,NULL,NULL,1670,0,0,2019
199722144,"Firehouse-0ptimus-Battleground-June-2019","optimus-forecasting-and-polling/Firehouse-0ptimus-Battleground-June-2019",53236856,"https://github.com/optimus-forecasting-and-polling/Firehouse-0ptimus-Battleground-June-2019","Michigan, Pennsylvania, and Wisconsin Battleground Poll Conducted in June 2019",NULL,NULL,0,0,0,0,1,NULL,NULL,1757,0,0,2019
199722006,"Firehouse-0ptimus-Battleground-March-2019","optimus-forecasting-and-polling/Firehouse-0ptimus-Battleground-March-2019",53236856,"https://github.com/optimus-forecasting-and-polling/Firehouse-0ptimus-Battleground-March-2019","Michigan, Pennsylvania, and Wisconsin Battleground Poll Conducted in March 2019",NULL,NULL,0,0,0,0,1,NULL,NULL,1768,0,0,2019
245923660,"Firehouse-0ptimus-Battleground-March-2020","optimus-forecasting-and-polling/Firehouse-0ptimus-Battleground-March-2020",53236856,"https://github.com/optimus-forecasting-and-polling/Firehouse-0ptimus-Battleground-March-2020","Michigan, Pennsylvania, and Wisconsin Battleground Poll Conducted in March 2020",NULL,NULL,0,0,0,0,1,NULL,NULL,1599,0,0,2020
208110389,"Firehouse-0ptimus-Battleground-September-2019","optimus-forecasting-and-polling/Firehouse-0ptimus-Battleground-September-2019",53236856,"https://github.com/optimus-forecasting-and-polling/Firehouse-0ptimus-Battleground-September-2019","Michigan, Pennsylvania, and Wisconsin Battleground Poll Conducted in September 2019",NULL,NULL,0,0,0,0,1,NULL,NULL,1596,0,0,2019
396930653,"fire_needs_assessment_protocol","staceymarion/fire_needs_assessment_protocol",74550850,"https://github.com/staceymarion/fire_needs_assessment_protocol","Scripts associated with the 2021 Wisconsin Prescribed Fire Needs Assessment, a template assessment for quantifying and prioritizing prescribed fire needs in regions of the United States (see http://staceymarion.com/fna/). This protocol is adapted from a 2014 fire needs assessment (Hmielowski et al. 2016, ""Prioritizing land management efforts at a landscape scale: a case study using prescribed fire in Wisconsin""). See  ",NULL,"R",0,0,0,0,1,NULL,NULL,452,0,0,2021
692396082,"FirstNN","Benelini/FirstNN",64533574,"https://github.com/Benelini/FirstNN","Neural network to clasify tumors from the Breast Cancer Wisconsin Data Set",NULL,"Python",0,0,0,0,1,NULL,NULL,333,0,0,2023
14633650,"FishLog","esleezy/FishLog",5818386,"https://github.com/esleezy/FishLog","An online logbook for anglers in Wisconsin",NULL,NULL,0,0,0,0,1,NULL,NULL,NULL,0,0,2013
194161116,"Flatiron_cancer","max-miller/Flatiron_cancer",47898123,"https://github.com/max-miller/Flatiron_cancer","Summative project for classification. Using the Wisconsin Breast Cancer dataset.",NULL,"Jupyter Notebook",0,0,0,0,1,NULL,NULL,2484,1,0,2019
360003452,"flight-release-parsing","haendd/flight-release-parsing",48295397,"https://github.com/haendd/flight-release-parsing","flight release parser for Air Wisconsin Interview ",NULL,"Java",0,0,0,0,1,NULL,NULL,350,0,0,2021
333972799,"FNA-Logregression","steve133t/FNA-Logregression",33070677,"https://github.com/steve133t/FNA-Logregression","Used the Wisconsin Diagnostic Breast Cancer dataset to classify suspected FNA cells to Benign (class 0) or Malignant (class 1) using logistic regression as the classifier. The features used for classification are pre-computed from images of a fine needle aspirate (FNA) of a breast mass. Acheived a accuracy of 98% upon training with the given features.",NULL,"Jupyter Notebook",0,0,0,0,1,NULL,NULL,NULL,0,0,2021
33154468,"FoliageFeud","AdamHolcombe/FoliageFeud",11728646,"https://github.com/AdamHolcombe/FoliageFeud","Foliage Feud is a 2D educational game meant to teach people how to find and identify plants. It was developed for a Biology professor at University of Wisconsin - Stout and made for a 2D Game Design and Development class. ",NULL,NULL,0,0,0,0,1,NULL,NULL,NULL,0,0,2015
261171072,"Forecasting-sales-of-Walmart-retail-goods","pdwytr/Forecasting-sales-of-Walmart-retail-goods",63578012,"https://github.com/pdwytr/Forecasting-sales-of-Walmart-retail-goods","Note: This is one of the two complementary competitions that together comprise the M5 forecasting challenge. Can you estimate, as precisely as possible, the point forecasts of the unit sales of various products sold in the USA by Walmart? If you are interested in estimating the uncertainty distribution of the realized values of the same series, be sure to check out its companion competition  How much camping gear will one store sell each month in a year? To the uninitiated, calculating sales at this level may seem as difficult as predicting the weather. Both types of forecasting rely on science and historical data. While a wrong weather forecast may result in you carrying around an umbrella on a sunny day, inaccurate business forecasts could result in actual or opportunity losses. In this competition, in addition to traditional forecasting methods youre also challenged to use machine learning to improve forecast accuracy.  The Makridakis Open Forecasting Center (MOFC) at the University of Nicosia conducts cutting-edge forecasting research and provides business forecast training. It helps companies achieve accurate predictions, estimate the levels of uncertainty, avoiding costly mistakes, and apply best forecasting practices. The MOFC is well known for its Makridakis Competitions, the first of which ran in the 1980s.  In this competition, the fifth iteration, you will use hierarchical sales data from Walmart, the worlds largest company by revenue, to forecast daily sales for the next 28 days. The data, covers stores in three US States (California, Texas, and Wisconsin) and includes item level, department, product categories, and store details. In addition, it has explanatory variables such as price, promotions, day of the week, and special events. Together, this robust dataset can be used to improve forecasting accuracy.  If successful, your work will continue to advance the theory and practice of forecasting. The methods used can be applied in various business areas, such as setting up appropriate inventory or service levels. Through its business support and training, the MOFC will help distribute the tools and knowledge so others can achieve more accurate and better calibrated forecasts, reduce waste and be able to appreciate uncertainty and its risk implications.  Acknowledgements Additional thanks go to other partner organizations and prize sponsors, National Technical University of Athens (NTUA), INSEAD, Google, Uber and IIF.",NULL,"R",8,8,1,0,1,NULL,NULL,3600,0,0,2020
769791650,"Foreign_trade_5_states","chriscamhm/Foreign_trade_5_states",74848214,"https://github.com/chriscamhm/Foreign_trade_5_states","Evolution of the international trade of Michigan and its neighbour states Wisconsin, Ohio, Illinois and Indiana,by an animated and interactive graphic. The data used are exports, imports and balance trade extracted by scrapping web tecnhniques from the USA Census Bureau. ",NULL,"Jupyter Notebook",0,0,0,0,1,NULL,NULL,1477,0,0,2024
270811493,"Form-Parser-for-Wisconsin-Singers","samruh/Form-Parser-for-Wisconsin-Singers",25569219,"https://github.com/samruh/Form-Parser-for-Wisconsin-Singers","This is a script for parsing through the data returned from a form and making formatted sheets for use in the pre-show data gathering for Wisconsin Singers.",NULL,"JavaScript",0,0,0,0,1,NULL,NULL,572,0,0,2020
450268823,"freebikepass.com","aeharding/freebikepass.com",2166114,"https://github.com/aeharding/freebikepass.com","Website to promote Dane County`s free Wisconsin bike trail pass program for bicyclists using trails for transportation.","https://freebikepass.com","TypeScript",1,1,0,0,1,"mit","MIT License",1431,0,0,2022
196510716,"FreethoughtRadio","leopheard/FreethoughtRadio",40130895,"https://github.com/leopheard/FreethoughtRadio","Kodi / XMBC / Firestick audio addon for the Freethought Radio podcast from the Freedom From Religion Foundation","https://ffrf.org","Python",1,1,0,0,1,"gpl-3.0","GNU General Public License v3.0",1381,1,0,2019
102779615,"FreshmanYearCS","enrajka/FreshmanYearCS",25290295,"https://github.com/enrajka/FreshmanYearCS","Programs created during my freshman year at the University of Wisconsin-Madison",NULL,NULL,0,0,0,0,1,NULL,NULL,97,0,0,2017
22559895,"Friendship-Club-Cook-Book_42631","GITenberg/Friendship-Club-Cook-Book_42631",1957667,"https://github.com/GITenberg/Friendship-Club-Cook-Book_42631","Friendship Club Cook Book by Friendship Club (Madison, Wisconsin)
 is a Project Gutenberg book, now on Github.","https://www.GITenberg.org/","HTML",0,0,0,0,1,"other","Other",NULL,0,0,2014
482700406,"FromWisconsin","FromWisconsin/FromWisconsin",103914569,"https://github.com/FromWisconsin/FromWisconsin","Config files for my GitHub profile.","https://github.com/FromWisconsin","CSS",0,0,0,0,1,NULL,NULL,360,0,0,2022
395490379,"FS-Portfolio-Website","CodyNicholson/FS-Portfolio-Website",12117258,"https://github.com/CodyNicholson/FS-Portfolio-Website","The portfolio website I made in my Wisconsin Madison FS Bootcamp!!",NULL,"HTML",0,0,0,0,1,NULL,NULL,131,0,0,2021
175697254,"Fund","yfmyfmyfm/Fund",30219496,"https://github.com/yfmyfmyfm/Fund","This paper is discussing how can we predict output, as measured by publications and citations, based on specific conditioning factors including:Project size as proxied by total expenditures, Relative portion of funding allocated to faculty, staff, and students, Funding mechanism (competitive, formula, other), Basic vs. applied science proportions, Time since completion, Science area (keywords) based on the data awarded by USDA to researchers at the University of Wisconsin--Madison during the period 2008-2016.",NULL,NULL,0,0,0,0,1,NULL,NULL,2697,0,0,2019
414760440,"funkcje-wykonawcze","jerzymajka/funkcje-wykonawcze",59937770,"https://github.com/jerzymajka/funkcje-wykonawcze","aplikacja Node-js  do badania pewnych funkcji mzgu testem Stroop`a i Sortowania Kart z Wisconsin ",NULL,"HTML",0,0,0,0,1,"gpl-3.0","GNU General Public License v3.0",120,0,0,2021
499201641,"gagekmoreno8","yunlyhotmail/gagekmoreno8",106763068,"https://github.com/yunlyhotmail/gagekmoreno8","Repository to store the most up to date code to Wisconsin Nextstrain builds",NULL,NULL,0,0,0,0,1,NULL,NULL,NULL,0,0,2022
405530031,"gagekmoreno8","eetwangheng/gagekmoreno8",82527172,"https://github.com/eetwangheng/gagekmoreno8","Repository to store the most up to date code to Wisconsin Nextstrain builds",NULL,NULL,0,0,0,0,1,NULL,NULL,91,0,0,2021
275678882,"gating","SteveGoldstein/gating",7879996,"https://github.com/SteveGoldstein/gating","COVID-19 Gating Diagnostics in Wisconsin",NULL,NULL,0,0,0,0,1,"gpl-3.0","GNU General Public License v3.0",50,0,0,2020
74775974,"Gazebo-Models","WisconsinRobotics/Gazebo-Models",12723622,"https://github.com/WisconsinRobotics/Gazebo-Models","A simulated model of various robots made by Wisconsin Robotics using the popular open source enviorment Gazebo.",NULL,"C++",1,1,1,0,1,NULL,NULL,878,0,0,2016
335468035,"GB-WIsconsin-Discord-Chat","bhaydin/GB-WIsconsin-Discord-Chat",3877779,"https://github.com/bhaydin/GB-WIsconsin-Discord-Chat","Discord Chatbot",NULL,NULL,0,0,0,0,1,NULL,NULL,44,0,0,2021
236301909,"gba-wcst-original","saschaklatt/gba-wcst-original",2530556,"https://github.com/saschaklatt/gba-wcst-original","Original card-based version of the Wisconsin Card Sorting Test",NULL,"TypeScript",0,0,0,0,1,NULL,NULL,185,0,0,2020
227377135,"gba-wisconsin-sorting-test","saschaklatt/gba-wisconsin-sorting-test",2530556,"https://github.com/saschaklatt/gba-wisconsin-sorting-test","Wisconsin Sorting Test Game",NULL,"TypeScript",0,0,0,0,1,NULL,NULL,277,0,0,2019
548212886,"GCU_ML_PHW1","masibasi/GCU_ML_PHW1",60805546,"https://github.com/masibasi/GCU_ML_PHW1","Machine Learning for ""Wisconsin Cancer Datasets""",NULL,"Jupyter Notebook",0,0,0,0,1,NULL,NULL,4005,0,0,2022
128688447,"GDD-Game","Game-Design-and-Development/GDD-Game",43870087,"https://github.com/Game-Design-and-Development/GDD-Game","University of Wisconsin Milwaukee Game Design and Development`s Spring 2018 Game",NULL,"Yacc",3,3,1,0,1,NULL,NULL,463,0,0,2018
20648356,"GEMS","gedare/GEMS",1657385,"https://github.com/gedare/GEMS","Wisconsin Multifacet General Execution-driven Multiprocessor Simulator (GEMS)",NULL,"C++",3,3,0,0,1,"gpl-2.0","GNU General Public License v2.0",1904,0,0,2014
159277051,"Genetic-Algorithm","thatchayut/Genetic-Algorithm",21120214,"https://github.com/thatchayut/Genetic-Algorithm","This program applies Genetic Algorithm to predict a class of breast cancer that are ""Malignant"" and ""Benign"" by using Wisconsin Diagnostic Breast Cancer (WDBC) Dataset.",NULL,"Python",0,0,0,0,1,NULL,NULL,1198,0,0,2018
107251768,"gentrification_vulnerability","tadhgfendt/gentrification_vulnerability",28760132,"https://github.com/tadhgfendt/gentrification_vulnerability","Implementing PSU`s gentrification vulnerability scoring methodology to Milwaukee County Wisconsin",NULL,"Jupyter Notebook",0,0,0,0,1,"mit","MIT License",2639,1,0,2017
164051669,"Geocomputing-Python","vladsliusar/Geocomputing-Python",31670686,"https://github.com/vladsliusar/Geocomputing-Python","GEOG378 class at University of Wisconsin - Madison (M.Sc. GIS Development)",NULL,"Python",0,0,0,0,1,NULL,NULL,125,0,0,2019
182110228,"GeoData","WIStCart/GeoData",8579949,"https://github.com/WIStCart/GeoData","Home of the GeoData@Wisconsin geoportal maintained by the University of Wisconsin-Madison.",NULL,"Ruby",4,4,0,15,1,NULL,NULL,1302,0,0,2019
