"id","name","full_name","owner_id","html_url","description","homepage","language","stargazers_count","watchers_count","forks_count","open_issues_count","score","license_key","license_name","readme_size","readme_has_images","readme_has_icons","year"
616938794,"t-SNE-vs-PCA-Analysis","nasiraliq/t-SNE-vs-PCA-Analysis",107787150,"https://github.com/nasiraliq/t-SNE-vs-PCA-Analysis","Analysis is done on Breast Cancer Wisconsin Data available on Kaggle.",NULL,NULL,0,0,0,0,1,NULL,NULL,94,0,0,2023
281490491,"Tableu-Visualzation","AmritChahal731/Tableu-Visualzation",67814616,"https://github.com/AmritChahal731/Tableu-Visualzation","ILI Activity Map Data collected in ILINet are used to produce a measure of ILI activity* by state.  During week 28, the following ILI activity levels were experienced:  Moderate  Puerto Rico and one state (Louisiana). Low Three states (Florida, Georgia, and South Carolina). Minimal New York City, and 45 states (Alabama, Alaska, Arizona, Arkansas, California, Colorado, Connecticut, Delaware, Hawaii, Illinois, Indiana, Iowa, Kansas, Kentucky, Maine, Maryland, Massachusetts, Michigan, Minnesota, Mississippi, Missouri, Montana, Nebraska, Nevada, New Hampshire, New Jersey, New Mexico, New York, North Carolina, North Dakota, Ohio, Oklahoma, Oregon, Pennsylvania, Rhode Island, South Dakota, Tennessee, Texas, Utah, Vermont, Virginia, Washington, West Virginia, Wisconsin, and Wyoming). Data were insufficient to calculate an ILI activity level from the District of Columbia, the U.S. Virgin Islands and one state (Idaho).",NULL,NULL,0,0,0,0,1,NULL,NULL,NULL,0,0,2020
316314277,"TabNet_Vs_XGBoost_BCa_Wisconsin","DiegoOrdDataScience/TabNet_Vs_XGBoost_BCa_Wisconsin",74559180,"https://github.com/DiegoOrdDataScience/TabNet_Vs_XGBoost_BCa_Wisconsin","This project compares the area under the curve (AUC) of XGBoost and TabNet models using the BCa Wisconsin dataset from Kaggle. ",NULL,"Jupyter Notebook",0,0,1,0,1,NULL,NULL,278,0,0,2020
108179603,"takedata3","tyler314/takedata3",8908725,"https://github.com/tyler314/takedata3","Code written while working in Plasma Physics at the University of Wisconsin - Madison. mstxray-takedata3 was my re-implementation of the main function.",NULL,"Python",0,0,0,0,1,NULL,NULL,NULL,0,0,2017
10327464,"Talk_CTC2013","kbroman/Talk_CTC2013",53972,"https://github.com/kbroman/Talk_CTC2013","Talk for Complex Trait Community 12th annual meeting in Madison, Wisconsin, 31 May 2013",NULL,"CoffeeScript",0,0,0,0,1,"other","Other",NULL,0,0,2013
8909592,"Talk_InteractiveGraphs3","kbroman/Talk_InteractiveGraphs3",53972,"https://github.com/kbroman/Talk_InteractiveGraphs3","A talk I gave to Biostatistics trainees at the University of Wisconsin-Madison on 8 April 2013: ""Why aren`t all of our graphs interactive?""","http://www.biostat.wisc.edu/~kbroman/talks/InteractiveGraphs3","CoffeeScript",1,1,0,0,1,"other","Other",NULL,0,0,2013
758630971,"Task-Intern-Career","MokamiAI/Task-Intern-Career",142388398,"https://github.com/MokamiAI/Task-Intern-Career","Breast Cancer Wisconsin",NULL,"Jupyter Notebook",0,0,0,0,1,NULL,NULL,75,0,0,2024
418212034,"ta_ece551project","tyee2/ta_ece551project",23202270,"https://github.com/tyee2/ta_ece551project","Project for ECE 551 Fall 2021 at University of Wisconsin-Madison",NULL,"SystemVerilog",0,0,0,0,1,NULL,NULL,2142,1,0,2021
72466226,"Technical_Recruiting-Minneapolis_MN","GKA-Recruiting/Technical_Recruiting-Minneapolis_MN",23175113,"https://github.com/GKA-Recruiting/Technical_Recruiting-Minneapolis_MN","ABOUT GEORGE KONIK ASSOCIATES TECHNICAL RECRUITING MINNEAPOLIS MINNESOTA www.georgekonik.com/ George Konik Associates 7242 Metro Boulevard, Suite 100 Minneapolis, MN 55439-2128 952-835-5550 George Konik Associates is a highly-respected Minneapolis technical positions recruiting firm since 1974 specializing in finding engineers and other hard-to-find technical talent for Minnesota and western Wisconsin companies. Placement services include civil, electrical, mechanical, hardware, software and manufacturing engineers; CAD experts; IT pros of all types; cross discipline architectural positions; and all-levels of management staff for all of these high-skilled technical disciplines. Engineer Recruiting Manufacturing Recruiting IT Recruiting Architect Recruiting CAD Recruiting",NULL,NULL,0,0,0,0,1,NULL,NULL,827,0,0,2016
306825598,"tempotron-wisconsin","Hideousmon/tempotron-wisconsin",43981919,"https://github.com/Hideousmon/tempotron-wisconsin","Spiking neuro model Tempotron with Wisconsin Dataset",NULL,"Python",0,0,1,0,1,NULL,NULL,282,0,0,2020
314302673,"TensorFlow-Classification","rajat1911996sharma/TensorFlow-Classification",73736268,"https://github.com/rajat1911996sharma/TensorFlow-Classification","## The Data  ### Breast cancer wisconsin (diagnostic) dataset --------------------------------------------  **Data Set Characteristics:**      :Number of Instances: 569      :Number of Attributes: 30 numeric, predictive attributes and the class      :Attribute Information:         - radius (mean of distances from center to points on the perimeter)         - texture (standard deviation of gray-scale values)         - perimeter         - area         - smoothness (local variation in radius lengths)         - compactness (perimeter^2 / area - 1.0)         - concavity (severity of concave portions of the contour)         - concave points (number of concave portions of the contour)         - symmetry          - fractal dimension (""coastline approximation"" - 1)          The mean, standard error, and ""worst"" or largest (mean of the three         largest values) of these features were computed for each image,         resulting in 30 features.  For instance, field 3 is Mean Radius, field         13 is Radius SE, field 23 is Worst Radius.          - class:                 - WDBC-Malignant                 - WDBC-Benign      :Summary Statistics:      ===================================== ====== ======                                            Min    Max     ===================================== ====== ======     radius (mean):                        6.981  28.11     texture (mean):                       9.71   39.28     perimeter (mean):                     43.79  188.5     area (mean):                          143.5  2501.0     smoothness (mean):                    0.053  0.163     compactness (mean):                   0.019  0.345     concavity (mean):                     0.0    0.427     concave points (mean):                0.0    0.201     symmetry (mean):                      0.106  0.304     fractal dimension (mean):             0.05   0.097     radius (standard error):              0.112  2.873     texture (standard error):             0.36   4.885     perimeter (standard error):           0.757  21.98     area (standard error):                6.802  542.2     smoothness (standard error):          0.002  0.031     compactness (standard error):         0.002  0.135     concavity (standard error):           0.0    0.396     concave points (standard error):      0.0    0.053     symmetry (standard error):            0.008  0.079     fractal dimension (standard error):   0.001  0.03     radius (worst):                       7.93   36.04     texture (worst):                      12.02  49.54     perimeter (worst):                    50.41  251.2     area (worst):                         185.2  4254.0     smoothness (worst):                   0.071  0.223     compactness (worst):                  0.027  1.058     concavity (worst):                    0.0    1.252     concave points (worst):               0.0    0.291     symmetry (worst):                     0.156  0.664     fractal dimension (worst):            0.055  0.208     ===================================== ====== ======      :Missing Attribute Values: None      :Class Distribution: 212 - Malignant, 357 - Benign      :Creator:  Dr. William H. Wolberg, W. Nick Street, Olvi L. Mangasarian      :Donor: Nick Street      :Date: November, 1995  This is a copy of UCI ML Breast Cancer Wisconsin (Diagnostic) datasets. https://goo.gl/U2Uwz2  Features are computed from a digitized image of a fine needle aspirate (FNA) of a breast mass.  They describe characteristics of the cell nuclei present in the image.  Separating plane described above was obtained using Multisurface Method-Tree (MSM-T) [K. P. Bennett, ""Decision Tree Construction Via Linear Programming."" Proceedings of the 4th Midwest Artificial Intelligence and Cognitive Science Society, pp. 97-101, 1992], a classification method which uses linear programming to construct a decision tree.  Relevant features were selected using an exhaustive search in the space of 1-4 features and 1-3 separating planes.  The actual linear program used to obtain the separating plane in the 3-dimensional space is that described in: [K. P. Bennett and O. L. Mangasarian: ""Robust Linear Programming Discrimination of Two Linearly Inseparable Sets"", Optimization Methods and Software 1, 1992, 23-34].  This database is also available through the UW CS ftp server:  ftp ftp.cs.wisc.edu cd math-prog/cpo-dataset/machine-learn/WDBC/  .. topic:: References     - W.N. Street, W.H. Wolberg and O.L. Mangasarian. Nuclear feature extraction       for breast tumor diagnosis. IS&T/SPIE 1993 International Symposium on       Electronic Imaging: Science and Technology, volume 1905, pages 861-870,      San Jose, CA, 1993.    - O.L. Mangasarian, W.N. Street and W.H. Wolberg. Breast cancer diagnosis and       prognosis via linear programming. Operations Research, 43(4), pages 570-577,       July-August 1995.    - W.H. Wolberg, W.N. Street, and O.L. Mangasarian. Machine learning techniques      to diagnose breast cancer from fine-needle aspirates. Cancer Letters 77 (1994)       163-171.",NULL,"Jupyter Notebook",0,0,0,0,1,NULL,NULL,2622,0,0,2020
345572003,"Tensorflow-Handwriting-Analysis","kenbacchiani/Tensorflow-Handwriting-Analysis",48099975,"https://github.com/kenbacchiani/Tensorflow-Handwriting-Analysis","Tensorflow Handwriting analysis written for introduction to Artificial Intelligence course at University of Wisconsin-Madison",NULL,"Python",0,0,0,0,1,NULL,NULL,407,0,0,2021
444003079,"TensorflowClassificationProject","Raphplaza/TensorflowClassificationProject",91761049,"https://github.com/Raphplaza/TensorflowClassificationProject","Tensorflow Classification Project with Breast cancer wisconsin (diagnostic) dataset",NULL,"Jupyter Notebook",0,0,0,0,1,NULL,NULL,NULL,0,0,2022
403103989,"tensorflow_demo","martinbacsi/tensorflow_demo",10885627,"https://github.com/martinbacsi/tensorflow_demo","Tensorflow neural network demo on breast-cancer-wisconsin dataset.",NULL,"Python",0,0,0,0,1,"gpl-3.0","GNU General Public License v3.0",85,0,0,2021
122273855,"terribly-vulnerable-webapp","StoutInfoSec/terribly-vulnerable-webapp",36682751,"https://github.com/StoutInfoSec/terribly-vulnerable-webapp","An intentionally vulernable web page. Created by the Information Security Professionals of University of Wisconsin-Stout.",NULL,"PHP",1,1,1,0,1,NULL,NULL,NULL,0,0,2018
128696242,"Test1_old","racontreras/Test1_old",34666279,"https://github.com/racontreras/Test1_old","This public repository is to be used to create my first public web site as a lab assignment for my Cartography course (Geography 572) at the University of Wisconsin, Madison, Spring 2018.",NULL,"HTML",0,0,0,0,1,NULL,NULL,197,0,0,2018
182506166,"Testing-PostgresSQl-with-Wisconsin-Benchmark","AmeeSankhesara/Testing-PostgresSQl-with-Wisconsin-Benchmark",47707621,"https://github.com/AmeeSankhesara/Testing-PostgresSQl-with-Wisconsin-Benchmark","Testing of PostgreSQL with Wisconsin Benchmark Paper ",NULL,"Java",0,0,0,0,1,NULL,NULL,46,0,0,2019
186065376,"Textures-and-Lighting","fwu96/Textures-and-Lighting",43053640,"https://github.com/fwu96/Textures-and-Lighting","This is the project done for CS559 course at University of Wisconsin-Madison, Spring 2019",NULL,"JavaScript",0,0,0,0,1,NULL,NULL,1847,0,0,2019
76135068,"TF_BionInfo","chrisxdef/TF_BionInfo",8881289,"https://github.com/chrisxdef/TF_BionInfo","Tensor Flow Nerual Network trained with Wisconsin breast cancer data.",NULL,"R",0,0,0,0,1,NULL,NULL,87,0,0,2016
513848356,"that-2022-wisconsin-schedule","fdalvi/that-2022-wisconsin-schedule",859719,"https://github.com/fdalvi/that-2022-wisconsin-schedule","Unofficial calendar view schedule for THAT Wisconsin (https://that.us/events/wi/2022/)","https://fdalvi.github.io/that-2022-wisconsin-schedule/","HTML",0,0,0,0,1,NULL,NULL,859,0,0,2022
517214795,"THAT-dotnet-interactive","zo0o0ot/THAT-dotnet-interactive",876146,"https://github.com/zo0o0ot/THAT-dotnet-interactive",".NET Interactive examples for THAT Conference 2022 in Wisconsin",NULL,"Jupyter Notebook",1,1,0,0,1,NULL,NULL,2592,1,0,2022
22431512,"The-Character-and-Influence-of-the-Indian-Trade-in-Wisconsin_20643","GITenberg/The-Character-and-Influence-of-the-Indian-Trade-in-Wisconsin_20643",1957667,"https://github.com/GITenberg/The-Character-and-Influence-of-the-Indian-Trade-in-Wisconsin_20643","The Character and Influence of the Indian Trade in Wisconsin by Turner, Frederick Jackson
 is a Project Gutenberg book, now on Github.","https://www.GITenberg.org/","HTML",0,0,0,0,1,"other","Other",NULL,0,0,2014
539581810,"The-Chattanooga-Campaign-With-especial-reference-to-Wisconsin-s-participation-therein_68855","GITenberg/The-Chattanooga-Campaign-With-especial-reference-to-Wisconsin-s-participation-therein_68855",1957667,"https://github.com/GITenberg/The-Chattanooga-Campaign-With-especial-reference-to-Wisconsin-s-participation-therein_68855","The Chattanooga Campaign: With especial reference to Wisconsin`s participation therein by Michael Hendrick Fitch is a Project Gutenberg book, now on Github.","https://www.GITenberg.org/","HTML",0,0,0,0,1,"other","Other",NULL,0,0,2022
22534855,"The-Geography-of-the-Region-about-Devil-s-Lake-and-the-Dalles-of-the-Wisconsin_38148","GITenberg/The-Geography-of-the-Region-about-Devil-s-Lake-and-the-Dalles-of-the-Wisconsin_38148",1957667,"https://github.com/GITenberg/The-Geography-of-the-Region-about-Devil-s-Lake-and-the-Dalles-of-the-Wisconsin_38148","The Geography of the Region about Devil`s Lake and the Dalles of the Wisconsin by Atwood, Wallace W. Salisbury, Rollin D.
 is a Project Gutenberg book, now on Github.","https://www.GITenberg.org/","HTML",0,0,0,0,1,"other","Other",NULL,0,0,2014
375819796,"The-Indians-in-Wisconsin-s-History_65504","GITenberg/The-Indians-in-Wisconsin-s-History_65504",1957667,"https://github.com/GITenberg/The-Indians-in-Wisconsin-s-History_65504","The Indians in Wisconsin`s History by John M. Douglass is a Project Gutenberg book, now on Github.","https://www.GITenberg.org/","HTML",0,0,0,0,1,"other","Other",NULL,0,0,2021
187671237,"the-lake-debate","datahub/the-lake-debate",3492801,"https://github.com/datahub/the-lake-debate","Who has more lakes: Minnesota or Wisconsin?","https://www.politifact.com/wisconsin/statements/2019/may/23/sara-meaney/who-has-more-lakes-minnesota-or-wisconsin/","Makefile",2,2,1,0,1,NULL,NULL,899,0,0,2019
150203403,"The-Wisconsin-Magazine-of-History-Volume-1-1917-1918_57176","GITenberg/The-Wisconsin-Magazine-of-History-Volume-1-1917-1918_57176",1957667,"https://github.com/GITenberg/The-Wisconsin-Magazine-of-History-Volume-1-1917-1918_57176","The Wisconsin Magazine of History, Volume 1, 1917-1918 by Various is a Project Gutenberg book, now on Github.","https://www.GITenberg.org/","HTML",0,0,0,0,1,"other","Other",NULL,0,0,2018
150050027,"The-Yankee-and-the-Teuton-in-Wisconsin_56012","GITenberg/The-Yankee-and-the-Teuton-in-Wisconsin_56012",1957667,"https://github.com/GITenberg/The-Yankee-and-the-Teuton-in-Wisconsin_56012","The Yankee and the Teuton in Wisconsin by Joseph Schafer is a Project Gutenberg book, now on Github.","https://www.GITenberg.org/","HTML",0,0,0,0,1,"other","Other",NULL,0,0,2018
544706134,"THEATRE338-Light-Control-Project","nathen418/THEATRE338-Light-Control-Project",23101313,"https://github.com/nathen418/THEATRE338-Light-Control-Project","Let you change the color of an LED with a tweet, or turn on a particular color with that same tweet. Made for the Create A Light project for my Lighting Productuon (THEATRE 338) class at the University of Wisconsin Milwaukee","https://nathen418.com","C++",0,0,0,0,1,"mit","MIT License",1196,1,0,2022
46188113,"ThePrairieHouse","sullic7/ThePrairieHouse",2721260,"https://github.com/sullic7/ThePrairieHouse","Website for The Prairie House, a vacation rental in Wisconsin.",NULL,"HTML",0,0,0,0,1,NULL,NULL,86,0,0,2015
91527339,"Thesis-Template-for-UW-Madison-Econ","josiex/Thesis-Template-for-UW-Madison-Econ",7685363,"https://github.com/josiex/Thesis-Template-for-UW-Madison-Econ","A crude template for dissertation that fulfills formatting requirement of the Department of Economics and the Graduate School at the University of Wisconsin - Madison",NULL,"TeX",0,0,0,0,1,NULL,NULL,782,0,0,2017
59183357,"thesis_template_UW-Madison","daijiang/thesis_template_UW-Madison",1696911,"https://github.com/daijiang/thesis_template_UW-Madison","PhD thesis template for the University of Wisconsin - Madison",NULL,"TeX",0,0,1,0,1,NULL,NULL,1190,0,0,2016
31074054,"things-to-do-in-wi","roddyongit/things-to-do-in-wi",7842136,"https://github.com/roddyongit/things-to-do-in-wi","Things to do in Wisconsin - Project for Developing Data Products Course with Coursera.org",NULL,"CSS",0,0,0,0,1,NULL,NULL,93,0,0,2015
186064765,"THREE-Transformation","fwu96/THREE-Transformation",43053640,"https://github.com/fwu96/THREE-Transformation","This is the project done for CS559 course at University of Wisconsin-Madison, Spring 2019",NULL,"JavaScript",0,0,0,0,1,NULL,NULL,3267,0,0,2019
30123474,"thw_server_demo","pshriwise/thw_server_demo",4563941,"https://github.com/pshriwise/thw_server_demo","Demo of the python SocketServer for the hacker within - wisconsin",NULL,"Python",0,0,0,0,1,NULL,NULL,84,0,0,2015
43966097,"Tillage_WDNR","marmotLauncher42/Tillage_WDNR",10837293,"https://github.com/marmotLauncher42/Tillage_WDNR","In progress NDTI calculation for Landsat scenes over a single county in Wisconsin, removing obscured pixels ",NULL,NULL,0,0,0,0,1,NULL,NULL,NULL,0,0,2015
357614808,"TimeSeriesAnalysis","MadisonPolley/TimeSeriesAnalysis",78385878,"https://github.com/MadisonPolley/TimeSeriesAnalysis","This is a collection of my Time Series Analysis homework from my class at the University of Wisconsin - Madison.",NULL,NULL,0,0,0,0,1,NULL,NULL,275,0,0,2021
189394537,"Time_Series_Project-Wisconsin_Employment","franckdess/Time_Series_Project-Wisconsin_Employment",25958951,"https://github.com/franckdess/Time_Series_Project-Wisconsin_Employment","Time series analysis of Wisconsin employment",NULL,"Jupyter Notebook",0,0,0,0,1,NULL,NULL,559,0,0,2019
107324310,"TogetherForward.github.io","TogetherForward/TogetherForward.github.io",32884257,"https://github.com/TogetherForward/TogetherForward.github.io","Website for the non-profit TogetherForward team for the University of Wisconsin-Madison`s MHR322 class.",NULL,"CSS",0,0,0,0,1,"mit","MIT License",NULL,0,0,2017
560693323,"Tornado_Prediction","Hoffman-Chris/Tornado_Prediction",58642303,"https://github.com/Hoffman-Chris/Tornado_Prediction","The final project for my introducion to data science course. Winter climate data was used to build a model that predicts whether or not a tornado will occur in different Wisconsin counties in a given year.",NULL,"Jupyter Notebook",0,0,0,0,1,NULL,NULL,NULL,0,0,2022
199497226,"townships-general-description","WIStCart/townships-general-description",8579949,"https://github.com/WIStCart/townships-general-description","General township descriptions from the original GLO land survey of wisconsin.",NULL,"HTML",0,0,0,0,1,NULL,NULL,171,0,0,2019
414077752,"Trabajo-de-Fundamento-del-L_d_P","SergeiSius/Trabajo-de-Fundamento-del-L_d_P",92009696,"https://github.com/SergeiSius/Trabajo-de-Fundamento-del-L_d_P","Ejercicio 1  Se le ha informado al alcalde de la ciudad de Wisconsin que probablemente llegue a su territorio un virus informtico (VLR-21). La expansin por los computadores de los habitantes est determinada por la sucesin de Fibonacci, es decir:  1,1,2,3,5,8 Genere un programa que le permita al alcalde ingresar una cantidad de das y obtener la cantidad de computadores infectados hasta ese da, por ejemplo:",NULL,NULL,0,0,0,0,1,NULL,NULL,NULL,0,0,2021
281963847,"TractIndex","WoodCountyWiGIS/TractIndex",68697169,"https://github.com/WoodCountyWiGIS/TractIndex","Wood County Wisconsin Tract Index for housing survey records organized by the Public Land Survey System (PLSS).",NULL,NULL,0,0,0,0,1,NULL,NULL,125,0,0,2020
55825362,"TrafficLightDemo","WisconsinRobotics/TrafficLightDemo",12723622,"https://github.com/WisconsinRobotics/TrafficLightDemo","Kinect 2 + Traffic Light demonstration for Wisconsin Robotics outreach events.",NULL,"C#",2,2,0,0,1,NULL,NULL,96,0,0,2016
481504505,"Training_Project01","fzahrah-mb/Training_Project01",100754320,"https://github.com/fzahrah-mb/Training_Project01","Feed Forward Neural Network for Breast Cancer Wisconsin (Diagnostic)",NULL,"Jupyter Notebook",0,0,0,0,1,"mit","MIT License",2616,0,0,2022
186064190,"Transformation-In-Math","fwu96/Transformation-In-Math",43053640,"https://github.com/fwu96/Transformation-In-Math","This is the project done for CS559 course at University of Wisconsin-Madison, Spring 2019",NULL,"JavaScript",0,0,0,0,1,NULL,NULL,1785,0,0,2019
341085691,"trax","kbrose/trax",4053170,"https://github.com/kbrose/trax","Super naive vaccination timeline estimates for Wisconsin",NULL,"Python",1,1,0,0,1,"mit","MIT License",2171,1,0,2021
303325327,"truck-map","LiteracyFanatic/truck-map",18249574,"https://github.com/LiteracyFanatic/truck-map","Map of Wisconsin with Kriete Group truck dealerships and technical colleges marked",NULL,"HTML",1,1,0,0,1,"mit","MIT License",95,1,0,2020
117377910,"TSLP_Project_Documentation","shivakrishna9989/TSLP_Project_Documentation",17553236,"https://github.com/shivakrishna9989/TSLP_Project_Documentation","This Project solution results to a feasibility for the administrator/Instructor to a particular class to track all the newly joined students who logged into the systems of Computer Science Department or the University systems with an associated Student id and a generated unique number which is a randomly generated 5 digits of Unique Number associated to username of the Student. In our case associated pair will be Foo**** ID and a 5 digit unique number which will be created at the first login of a student.  Random Unique Number generation for new Students in Concordia University Wisconsin Computers environment. ",NULL,NULL,0,0,0,0,1,NULL,NULL,1675,0,0,2018
125140211,"tumor-classification","SeanCooke/tumor-classification",7542731,"https://github.com/SeanCooke/tumor-classification","Random Forest classifier achieves 96% accuracy on diagnosis from Breast Cancer Wisconsin (Diagnostic) Data Set",NULL,"Python",0,0,1,0,1,"apache-2.0","Apache License 2.0",2449,1,0,2018
681425263,"tumor-classification-pca-svm","raulalmuzara/tumor-classification-pca-svm",91980091,"https://github.com/raulalmuzara/tumor-classification-pca-svm","Principal Component Analysis and Support Vector Machine for tumor classification in patients from the original Wisconsin breast cancer database.",NULL,"Jupyter Notebook",0,0,0,0,1,NULL,NULL,951,0,0,2023
284213820,"Tumor-Diagnosis","amulyasharma15/Tumor-Diagnosis",66059833,"https://github.com/amulyasharma15/Tumor-Diagnosis","In this project, I employed the statistical data visualization library, Seaborn, to discover and explore the relationships in the Breast Cancer Wisconsin (Diagnostic) data set. ",NULL,"Jupyter Notebook",0,0,0,0,1,NULL,NULL,395,0,0,2020
661045055,"tumordiagnoses","guidoBraam/tumordiagnoses",79934617,"https://github.com/guidoBraam/tumordiagnoses","Using the Wisconsin Breast Cancer Dataset, we visually investigate whether there is a correlation between the properties of cell nuclei and the malignancy of the tumor. We adopt a confirmatory approach. Along with that, we have defined two potential perspectives (ie. hypotheses) for this data narrative.",NULL,"Jupyter Notebook",0,0,0,0,1,"cc0-1.0","Creative Commons Zero v1.0 Universal",NULL,0,0,2023
636158358,"tumor_analysis","andidprastyo/tumor_analysis",89091156,"https://github.com/andidprastyo/tumor_analysis","Belajar Mata Kuliah Statistik Komputasi : Analisis Kanker Payudara di Wisconsin",NULL,"Jupyter Notebook",0,0,0,0,1,NULL,NULL,72,0,0,2023
589785441,"Tumor_Classification","munsonbrian/Tumor_Classification",58947046,"https://github.com/munsonbrian/Tumor_Classification","KNN applied to Wisconsin Diagnostic Breast Cancer Data Set",NULL,"Jupyter Notebook",0,0,0,0,1,NULL,NULL,412,0,0,2023
313515557,"Tumour-detection","PotatoinPyjamas/Tumour-detection",68746915,"https://github.com/PotatoinPyjamas/Tumour-detection","Breast Cancer Tumour  detection using Wisconsin dataset",NULL,"Jupyter Notebook",1,1,0,0,1,NULL,NULL,130,0,0,2020
337160438,"tutorials","WIStCart/tutorials",8579949,"https://github.com/WIStCart/tutorials","Tutorials from the Wisconsin State Cartographer`s Office.",NULL,NULL,1,1,0,0,1,NULL,NULL,1103,1,0,2021
30904375,"twitter-fun","henry-west/twitter-fun",2474750,"https://github.com/henry-west/twitter-fun","A program to see how ""Wisconsin"" WI-geotagged tweets are at a given time. Live-streams tweets",NULL,"Python",0,0,0,0,1,NULL,NULL,NULL,0,0,2015
195457167,"two_steps_forward","jhollist/two_steps_forward",5438539,"https://github.com/jhollist/two_steps_forward","Repository for talk given originally at USGS Wisconsin Water Science Center, July 2019",NULL,"R",0,0,0,0,1,NULL,NULL,2012,0,0,2019
48086174,"ubuntu-wisconsin-icons","ubuntuwisconsin/ubuntu-wisconsin-icons",16110441,"https://github.com/ubuntuwisconsin/ubuntu-wisconsin-icons","Icons based off the Material Design icons by Google for use on the Ubuntu Wisconsin website and elsewhere",NULL,NULL,0,0,0,0,1,NULL,NULL,165,0,0,2015
