"id","name","full_name","owner_id","html_url","description","homepage","language","stargazers_count","watchers_count","forks_count","open_issues_count","score","license_key","license_name","readme_size","readme_has_images","readme_has_icons","year"
309797616,"2020-11-17-uwm-online","tadamus/2020-11-17-uwm-online",8195123,"https://github.com/tadamus/2020-11-17-uwm-online","University of Wisconsin - Milwaukee Library Carpentry workshop taught virtually on November 17-18, 2020.","https://tadamus.github.io/2020-11-17-uwm-online/","HTML",0,0,1,0,1,"other","Other",10450,1,1,2020
627091840,"2023-04-18-utah-online","PhilReedData/2023-04-18-utah-online",25770348,"https://github.com/PhilReedData/2023-04-18-utah-online","Library Carpentry @ University of Utah and Advocate Health Wisconsin: April 18-20, 2023","https://philreeddata.github.io/2023-04-18-utah-online/","HTML",0,0,1,0,1,"other","Other",10897,1,1,2023
22534086,"A-Narrative-of-Service-with-the-Third-Wisconsin-Infantry_37754","GITenberg/A-Narrative-of-Service-with-the-Third-Wisconsin-Infantry_37754",1957667,"https://github.com/GITenberg/A-Narrative-of-Service-with-the-Third-Wisconsin-Infantry_37754","A Narrative of Service with the Third Wisconsin Infantry by Hinkley, Julian Wisner
 is a Project Gutenberg book, now on Github.","https://www.GITenberg.org/","HTML",0,0,0,0,1,"other","Other",NULL,0,0,2014
57077840,"a3-davidjuliancaldwell-shirleyswirley-jamesbrains","CSE512-16S/a3-davidjuliancaldwell-shirleyswirley-jamesbrains",17887297,"https://github.com/CSE512-16S/a3-davidjuliancaldwell-shirleyswirley-jamesbrains","Visualization of prognostic outcome with cellular features for the Wisconsin Breast Cancer prognosis dataset.","https://cse512-16s.github.io/a3-davidjuliancaldwell-shirleyswirley-jamesbrains/","JavaScript",0,0,0,0,1,NULL,NULL,9198,1,0,2016
155903349,"abhayk1201.github.io","abhayk1201/abhayk1201.github.io",17141362,"https://github.com/abhayk1201/abhayk1201.github.io","Personal homepage: http://pages.cs.wisc.edu/~abhayk/     OR                ","https://abhayk1201.github.io/","HTML",0,0,0,0,1,NULL,NULL,642,0,0,2018
708281967,"acculynxEXT","ridgetopexteriors/acculynxEXT",148669151,"https://github.com/ridgetopexteriors/acculynxEXT","Created by Ridge Top Exteriors (Wisconsin Rapids Office): Automatically schedule follow-up calls in AccuLynx for optimized time management and profitability. The calendar will intelligently schedule follow-ups based on profitability and resource availability.","https://www.ridgetopexteriors.com/","JavaScript",0,0,0,0,1,NULL,NULL,5832,0,0,2023
731802896,"ada-2023-wi","Coleridge-Initiative/ada-2023-wi",37301016,"https://github.com/Coleridge-Initiative/ada-2023-wi","Wisconsin ADA 2023 training class focused on unemployment to reemployment transitions ","https://coleridge-initiative.github.io/ada-2023-wi/","TeX",0,0,0,0,1,NULL,NULL,1367,0,0,2023
324314398,"badgerhacks.github.io","badgerhacks/badgerhacks.github.io",76580055,"https://github.com/badgerhacks/badgerhacks.github.io","Website for BadgerHacks hackathon. ","https://badgerhacks.github.io/","JavaScript",0,0,0,0,1,NULL,NULL,595,0,0,2020
55796613,"beer-near","datahub/beer-near",3492801,"https://github.com/datahub/beer-near","List of Wisconsin breweries","http://projects.jsonline.com/apps/BeerNear/","JavaScript",1,1,0,21,1,NULL,NULL,1258,0,0,2016
14215710,"bertblog","bertspaan/bertblog",1194896,"https://github.com/bertspaan/bertblog","Rencarnatie van `t fotoblog dat ik bijhield tijdens m`n verblijf in Madison, Wisconsin","http://bertspaan.nl/bertblog","CSS",0,0,0,0,1,NULL,NULL,NULL,0,0,2013
130440861,"better-by-design","kedarjoyner/better-by-design",12139428,"https://github.com/kedarjoyner/better-by-design","Better By Design conference Wordpress theme created by Dirigible Studio in Madison Wisconsin in collaboration with Kedar Joyner.","http://dirigiblestudio.com/","PHP",0,0,0,0,1,NULL,NULL,NULL,0,0,2018
188107439,"better-know-wisconsin","chriscarlsondev/better-know-wisconsin",49646269,"https://github.com/chriscarlsondev/better-know-wisconsin","A quiz app built using HTML5, CSS, Javascript and JQuery","https://chriscarlsondev.github.io/better-know-wisconsin/","JavaScript",0,0,0,0,1,NULL,NULL,NULL,0,0,2019
130158065,"BoardSchedule","lzyplayer/BoardSchedule",20348451,"https://github.com/lzyplayer/BoardSchedule","A homework of University of Wisconsin-madison","http://cs300-www.cs.wisc.edu/wp/index.php/2018/04/10/p09-boarding-scheduler/","Java",0,0,0,0,1,NULL,NULL,62,0,0,2018
258392038,"BoatLG","KurtzweilJames/BoatLG",16965662,"https://github.com/KurtzweilJames/BoatLG","Resources for boating on Geneva Lake, Wisconsin.","https://boatlg.com","HTML",0,0,0,1,1,NULL,NULL,433,0,1,2020
84489308,"BordnerCoastal","WIStCart/BordnerCoastal",8579949,"https://github.com/WIStCart/BordnerCoastal","Collaborative project between Forest Landscape and Ecology Lab (FLEL) and State Cartographer`s Office (SCO). Web-based mapping application featuring point, line, and polygon data digitized from the Wisconsin Land Economic Inventory (a.k.a. ""Bordner"" survey maps) for Wisconsin`s coastal counties. ","https://maps.sco.wisc.edu/BordnerCoastal/","JavaScript",0,0,2,12,1,NULL,NULL,11191,0,0,2017
252146,"Brainmap","brainmap/Brainmap",105366,"https://github.com/brainmap/Brainmap","Public website for the Wisconsin ADRC Imaging Core Laboratory","http://brainmap.wisc.edu","Ruby",6,6,2,4,1,NULL,NULL,NULL,0,0,2009
691285062,"campus-map","UW-Madison-DSI/campus-map",62457943,"https://github.com/UW-Madison-DSI/campus-map","This is an interactive web-based mapping application that allows exploration of the campus at the University of Wisconsin-Madison.","http://maps.datascience.wisc.edu","JavaScript",0,0,0,0,1,"mit","MIT License",924,1,1,2023
29434477,"cenwidev-gameloop","gheeres/cenwidev-gameloop",1309506,"https://github.com/gheeres/cenwidev-gameloop","Central Wisconsin Developers Group - Intro To Game Development (Part 1) - The Game Loop: Example code from presentation.","http://blog.heeresonline.com/2015/01/intro-to-game-development-part-1-the-game-loop/","Java",6,6,2,0,1,NULL,NULL,558,0,0,2015
365373989,"code-and-power-final-project","arielrezinn/code-and-power-final-project",44247064,"https://github.com/arielrezinn/code-and-power-final-project","This is a final project for LIS 500: Code and Power at the University of Wisconsin-Madison","http://codeandpower.infinityfreeapp.com/","PHP",0,0,2,0,1,NULL,NULL,NULL,0,0,2021
553802020,"community-map","UW-Madison-DSI/community-map",62457943,"https://github.com/UW-Madison-DSI/community-map","The Community Map is a an interactive web-based map that allows exploration of the community of faculty, staff, and students at the University of Wisconsin-Madison.","https://maps.datascience.wisc.edu","JavaScript",0,0,0,1,1,"mit","MIT License",1653,1,1,2022
188076899,"Computer-Graphic-Course-Project","usraptor2016/Computer-Graphic-Course-Project",29090076,"https://github.com/usraptor2016/Computer-Graphic-Course-Project","This project was created for the Computer Graphics class at the University of Wisconsin in Spring of 2019 and uses the class software framework","http://graphics.cs.wisc.edu/WP/cs559-sp2019/","HTML",0,0,0,0,1,NULL,NULL,178,0,0,2019
355445263,"Course-Management-System","aarunishsinha/Course-Management-System",58175652,"https://github.com/aarunishsinha/Course-Management-System","A Course Management System for The University of Wisconsin Madison. Done as a project in the COL362: Introductio to DBMS course at IIT Delhi","https://drive.google.com/file/d/1mJKFb27aCpLbkgED3ENUNf29iWzZXxPC/view?usp=sharing","Python",2,2,1,0,1,"mit","MIT License",8406,1,0,2021
273574365,"covid-wisconsin","mattbayer/covid-wisconsin",67168398,"https://github.com/mattbayer/covid-wisconsin","Analysis and visualization of Covid data in Wisconsin.","https://covid-wisconsin.com","HTML",1,1,0,0,1,NULL,NULL,229,0,0,2020
514304307,"Covid19Wastewater","UW-Madison-DSI/Covid19Wastewater",62457943,"https://github.com/UW-Madison-DSI/Covid19Wastewater","Covid19Wastewater is intended to make the process of analyzing epidemiological wastewater data easier and more insightful. It includes tools for preparing, analyzing, and visualizing data. It additionally includes Wisconsin`s Covid19 data.","https://github.com/UW-Madison-DSI/Covid19Wastewater","R",3,3,0,0,1,"other","Other",3693,0,1,2022
3706885,"cropcal","nbest937/cropcal",303517,"https://github.com/nbest937/cropcal","A collection of code used to download, ingest, and analyze the Crop Calendar Dataset from the Center for Sustainability and the Global Environment (SAGE) at the University of Wisconsin-Madison","http://www.sage.wisc.edu/download/sacks/crop_calendar.html",NULL,1,1,0,0,1,NULL,NULL,NULL,0,0,2012
122649579,"cwitc-website","CenWIDev/cwitc-website",12644252,"https://github.com/CenWIDev/cwitc-website","The site for the Central Wisconsin IT Conference","http://cwitc.org/","TypeScript",3,3,3,18,1,"mit","MIT License",5412,1,0,2018
135079928,"Dairy-IOT-Project-WISEST","chairithinug/Dairy-IOT-Project-WISEST",32557260,"https://github.com/chairithinug/Dairy-IOT-Project-WISEST","Welcome to the Wisconsin Embedded Systems and Computing Project (Summer 2018)","https://wisest.ece.wisc.edu/","C++",0,0,0,0,1,NULL,NULL,4849,0,0,2018
147370871,"DashboardDesign","Helios-UWMadison/DashboardDesign",42970742,"https://github.com/Helios-UWMadison/DashboardDesign","Energy dashboard created by the Helios student organization for the University of Wisconsin - Madison","http://www.helios-uw.com/index.html","HTML",1,1,1,0,1,NULL,NULL,989,1,0,2018
192946985,"DECARCERATION-PLATFORM","codeformilwaukee/DECARCERATION-PLATFORM",50022592,"https://github.com/codeformilwaukee/DECARCERATION-PLATFORM",NULL,"https://wisdp.com","JavaScript",18,18,17,37,1,"gpl-3.0","GNU General Public License v3.0",3349,0,0,2019
99144701,"ECE-524-Tesla-s-Positioning-Problem","roumenguha/ECE-524-Tesla-s-Positioning-Problem",7489173,"https://github.com/roumenguha/ECE-524-Tesla-s-Positioning-Problem","This project was completed for ECE 524: Introduction to Optimization at the University of Wisconsin-Madison, in the Spring of 2017.","http://www.laurentlessard.com/teaching/524-intro-to-optimization/","Jupyter Notebook",0,0,0,0,1,NULL,NULL,864,0,0,2017
297262927,"Ensemble-Learning-Cancer","angeloruggieridj/Ensemble-Learning-Cancer",19648591,"https://github.com/angeloruggieridj/Ensemble-Learning-Cancer","Python Notebook for Ensemble Learning on Wisconsin Breast Cancer Database","https://www.kaggle.com/angeloruggieridj/ensemble-learning-cancer","Jupyter Notebook",1,1,0,0,1,NULL,NULL,NULL,0,0,2020
450268823,"freebikepass.com","aeharding/freebikepass.com",2166114,"https://github.com/aeharding/freebikepass.com","Website to promote Dane County`s free Wisconsin bike trail pass program for bicyclists using trails for transportation.","https://freebikepass.com","TypeScript",1,1,0,0,1,"mit","MIT License",1431,0,0,2022
196510716,"FreethoughtRadio","leopheard/FreethoughtRadio",40130895,"https://github.com/leopheard/FreethoughtRadio","Kodi / XMBC / Firestick audio addon for the Freethought Radio podcast from the Freedom From Religion Foundation","https://ffrf.org","Python",1,1,0,0,1,"gpl-3.0","GNU General Public License v3.0",1381,1,0,2019
22559895,"Friendship-Club-Cook-Book_42631","GITenberg/Friendship-Club-Cook-Book_42631",1957667,"https://github.com/GITenberg/Friendship-Club-Cook-Book_42631","Friendship Club Cook Book by Friendship Club (Madison, Wisconsin)
 is a Project Gutenberg book, now on Github.","https://www.GITenberg.org/","HTML",0,0,0,0,1,"other","Other",NULL,0,0,2014
482700406,"FromWisconsin","FromWisconsin/FromWisconsin",103914569,"https://github.com/FromWisconsin/FromWisconsin","Config files for my GitHub profile.","https://github.com/FromWisconsin","CSS",0,0,0,0,1,NULL,NULL,360,0,0,2022
22421868,"Growing-Nuts-in-the-North--13-A-Personal-Story-of-the-Author-s-Experience-of-33-Years-with-Nu__18189","GITenberg/Growing-Nuts-in-the-North--13-A-Personal-Story-of-the-Author-s-Experience-of-33-Years-with-Nu__18189",1957667,"https://github.com/GITenberg/Growing-Nuts-in-the-North--13-A-Personal-Story-of-the-Author-s-Experience-of-33-Years-with-Nu__18189","Growing Nuts in the North&#13;A Personal Story of the Author`s Experience of 33 Years with Nut Culture in Minnesota and Wisconsin by Weschcke, Carl
 is a Project Gutenberg book, now on Github.","https://www.GITenberg.org/","HTML",0,0,0,0,1,"other","Other",NULL,0,0,2014
294243727,"HammockHelper","yocarrotyo/HammockHelper",58454552,"https://github.com/yocarrotyo/HammockHelper","Hammock Helper is a java-based webapp for looking up hammock-friendly campsites at state parks in Wisconsin. Registered users can also add data about sites they`re familiar with and help with validation of other users` submissions. Never pack a tent again!","http://3.12.23.13:8080/HammockHelper/","Java",0,0,0,8,1,NULL,NULL,NULL,0,0,2020
147356172,"Helios-Website","Helios-UWMadison/Helios-Website",42970742,"https://github.com/Helios-UWMadison/Helios-Website","The website for Helios - a sustainability student organization at the University of Wisconsin - Madison","http://www.helios-uw.com/index.html","HTML",0,0,0,0,1,NULL,NULL,266,0,0,2018
170910295,"HeliosWebsite","Helios-UWMadison/HeliosWebsite",42970742,"https://github.com/Helios-UWMadison/HeliosWebsite","website for the Helios renewable energy student organization at the University of Wisconsin-Madison.","https://s3.us-east-2.amazonaws.com/helios-uw-website-devo/index.html","HTML",1,1,1,0,1,"mit","MIT License",169,0,0,2019
665164103,"HFExplorer","UW-Madison-DSI/HFExplorer",62457943,"https://github.com/UW-Madison-DSI/HFExplorer","HFExplorer is a web based viewer created by the University of Wisconsin-Madison for displaying particle physics data formatted as HistFactory workspaces.","https://www.hfexplorer.net","JavaScript",0,0,0,0,1,"mit","MIT License",2584,1,1,2023
22537412,"Historic-Waterways-Six-Hundred-Miles-of-Canoeing-Down-the-Rock-Fox-and-Wisconsin-Rivers_38556","GITenberg/Historic-Waterways-Six-Hundred-Miles-of-Canoeing-Down-the-Rock-Fox-and-Wisconsin-Rivers_38556",1957667,"https://github.com/GITenberg/Historic-Waterways-Six-Hundred-Miles-of-Canoeing-Down-the-Rock-Fox-and-Wisconsin-Rivers_38556","Historic WaterwaysSix Hundred Miles of Canoeing Down the Rock, Fox, and Wisconsin Rivers by Thwaites, Reuben Gold
 is a Project Gutenberg book, now on Github.","https://www.GITenberg.org/","HTML",0,0,0,0,1,"other","Other",NULL,0,0,2014
306230818,"Housing-Project","matt3209/Housing-Project",52147717,"https://github.com/matt3209/Housing-Project","Affordable Housing Search Engine based on User Inputs to find Housing that said user qualifies for in the communities they are looking. Only working for for Wisconsin. ","https://housingproject.azurewebsites.net/","JavaScript",0,0,0,0,1,NULL,NULL,1096,0,0,2020
400548278,"INFOST240","nathen418/INFOST240",23101313,"https://github.com/nathen418/INFOST240","A repo of all the code written for my INFOST240 class at the University of Wisconsin Milwaukee. Kept as an archive.","https://goldsbo3.uwmsois.com","HTML",0,0,0,0,1,"other","Other",1061,0,0,2021
536630423,"INFOST440","nathen418/INFOST440",23101313,"https://github.com/nathen418/INFOST440","A repo of all the code written for my INFOST440 class at the University of Wisconsin Milwaukee. Kept as an archive.","htttps://nathen418.com","PHP",0,0,0,0,1,"other","Other",1041,0,0,2022
691296155,"knowledge-map","UW-Madison-DSI/knowledge-map",62457943,"https://github.com/UW-Madison-DSI/knowledge-map","This is an is an interactive web-based mapping application that enables a visual exploration of people, collaborations, and activities at the University of Wisconsin-Madison.","https://maps.datascience.wisc.edu/knowledge","JavaScript",0,0,0,1,1,"mit","MIT License",1598,1,1,2023
1358726,"linux-lhc","whilp/linux-lhc",189851,"https://github.com/whilp/linux-lhc","Slides for a talk on how the University of Wisconsin uses Linux and free software to solve  big physics problems","http://will.m.aier.us/linux-lhc",NULL,1,1,0,0,1,NULL,NULL,NULL,0,0,2011
578341993,"MadCourseEvaluator","bryxli/MadCourseEvaluator",51398314,"https://github.com/bryxli/MadCourseEvaluator","COMP SCI 506 | Software Engineering | University of Wisconsin-Madison Spring 2022","https://madgers.netlify.app/","Python",0,0,0,0,1,NULL,NULL,184,0,0,2022
92213379,"madison-parks","kipkosek/madison-parks",20775777,"https://github.com/kipkosek/madison-parks","An app for parks in Madison, Wisconsin, using Ruby on Rails, JavaScript, the New Age Bootstrap theme, and the City of Madison Socrata API.","https://madcityparks.herokuapp.com/","Ruby",0,0,0,3,1,NULL,NULL,1807,1,0,2017
436112127,"map","LAXBikeMap/map",95733026,"https://github.com/LAXBikeMap/map","Bike lanes & trails in La Crosse, WI","https://laxbikemap.github.io/map/","JavaScript",0,0,0,0,1,NULL,NULL,NULL,0,0,2021
183938750,"MAP671-Module-03","Tscholten1/MAP671-Module-03",22805382,"https://github.com/Tscholten1/MAP671-Module-03","Map of Wisconsin rivers and waterbodies","https://tscholten1.github.io/MAP671-Module-03/","QML",0,0,0,0,1,NULL,NULL,1564,0,0,2019
629748133,"meta-hair-day","leonardojacomussi/meta-hair-day",49487171,"https://github.com/leonardojacomussi/meta-hair-day","Based in Madison, Wisconsin, Hair Day is a boutique hair salon that specializes in cut, color and styling.","https://leonardojacomussi.github.io/meta-hair-day/","CSS",0,0,0,0,1,NULL,NULL,988,1,0,2023
76813417,"NASA-GeneLab--MicroArray-Codes","dr-richard-barker/NASA-GeneLab--MicroArray-Codes",8679982,"https://github.com/dr-richard-barker/NASA-GeneLab--MicroArray-Codes","These rough R codes have been used to analyze transcriptomic and plant physiological data as part of the Gilroy NASA GeneLab program at the University of Madison-Wisconsin.","https://genelab-data.ndc.nasa.gov/genelab/projects/","HTML",2,2,3,0,1,NULL,NULL,400,0,0,2016
207145690,"nitrate-cancer-analysis","treecasiano/nitrate-cancer-analysis",7842151,"https://github.com/treecasiano/nitrate-cancer-analysis","A tool for analyzing the relationship between nitrate levels and cancer rates in Wisconsin","http://treecasiano.github.io/nitrate-cancer-analysis","Vue",0,0,0,26,1,NULL,NULL,1582,0,0,2019
152466618,"Nitrate_CancerRate","sgrosenick/Nitrate_CancerRate",9851008,"https://github.com/sgrosenick/Nitrate_CancerRate","An interactive analysis of the relationship of between nitrate levels and cancer rates in Wisconsin","https://sgrosenick.github.io/Nitrate_CancerRate/","JavaScript",0,0,0,0,1,NULL,NULL,NULL,0,0,2018
415751534,"nitrate_cancer_esrI_dashboard","bstrock/nitrate_cancer_esrI_dashboard",54157762,"https://github.com/bstrock/nitrate_cancer_esrI_dashboard","ESRI Dashboard example: Wisconsin Nitrate Cancer Explorer.  Uses Jupyter Notebooks, ArcGIS Online, and ESRI Experience Builder","https://uw-mad.maps.arcgis.com/apps/webappviewer/index.html?id=7d7e739eff3d45d490ea207f4c7ee40f","Jupyter Notebook",1,1,0,0,1,NULL,NULL,2777,1,0,2021
254710538,"nyt-article-recreation","skent259/nyt-article-recreation",41379385,"https://github.com/skent259/nyt-article-recreation","Understanding the prevalence and spread of COVID-19 across Wisconsin metro areas ","https://data-viz.it.wisc.edu/wi-metro-growth-rate/","R",0,0,1,0,1,"mit","MIT License",1938,0,0,2020
687679697,"ospo.wisc.edu","UW-Madison-DSI/ospo.wisc.edu",62457943,"https://github.com/UW-Madison-DSI/ospo.wisc.edu","Web site for the University of Wisconsin-Madison Open Source Program Office","http://ospo.wisc.edu","HTML",0,0,0,0,1,NULL,NULL,766,0,1,2023
22563519,"Papers-and-Proceedings-of-the-Twenty-Third-General-Meeting-of-the-American-Library-Associatio__44406","GITenberg/Papers-and-Proceedings-of-the-Twenty-Third-General-Meeting-of-the-American-Library-Associatio__44406",1957667,"https://github.com/GITenberg/Papers-and-Proceedings-of-the-Twenty-Third-General-Meeting-of-the-American-Library-Associatio__44406","Papers and Proceedings of the Twenty-Third General Meeting of the American Library AssociationHeld at Waukesha, Wisconsin, Jul 4-10, 1901 by Various Association, American Library
 is a Project Gutenberg book, now on Github.","https://www.GITenberg.org/","HTML",0,0,0,0,1,"other","Other",NULL,0,0,2014
81989979,"ParcelProcessingTools","WIStCart/ParcelProcessingTools",8579949,"https://github.com/WIStCart/ParcelProcessingTools","Suite of Python geoprocessing tools to serve purpose of data preparation for the Wisconsin Statewide Parcel Map Initiative. Tools developed around the ArcPy module and tested under ArcGIS versions 10.2-10.5","https://www.sco.wisc.edu/parcels/tools/","Python",1,1,0,4,1,NULL,NULL,231,0,0,2017
75210625,"ParcelValidationTool","WIStCart/ParcelValidationTool",8579949,"https://github.com/WIStCart/ParcelValidationTool","Python tool designed to validate searchable format parcel submissions to the Wisconsin Parcel Initiative (ArcPy and Python 2.7 dependencies)","https://www.sco.wisc.edu/parcels/submission/","Python",1,1,0,6,1,"mit","MIT License",304,0,0,2016
280262914,"Park-planner","YengHV/Park-planner",61241205,"https://github.com/YengHV/Park-planner","Park Planner displays information, and a five-day weather forecast, for all state and national parks located in Iowa, Minnesota, North Dakota, South Dakota, and Wisconsin.","https://parkplannerarty.herokuapp.com/","JavaScript",0,0,0,0,1,NULL,NULL,1443,1,0,2020
527066502,"Peg-Solitaire","rjedwards105/Peg-Solitaire",54290212,"https://github.com/rjedwards105/Peg-Solitaire","This assignment has been designed as a self-assessment for students considering enrollment in CS300 at the University of Wisconsin-Madison.","https://cs300-www.cs.wisc.edu/wp/peg-solitaire/","Java",1,1,0,0,1,NULL,NULL,15,0,0,2022
69873485,"pension-shortfall-map","datahub/pension-shortfall-map",3492801,"https://github.com/datahub/pension-shortfall-map","Map to display various pension shortfalls across the state of Wisconsin","http://projects.jsonline.com/news/2016/9/25/Wisconsin-faces-billions-in-retiree-obligations.html","HTML",0,0,0,0,1,NULL,NULL,NULL,0,0,2016
644909387,"phyloverse.github.io","phyloverse/phyloverse.github.io",81586625,"https://github.com/phyloverse/phyloverse.github.io","Ph.D. candidate in Botany, University of Wisconsin-Madison","https://phyloverse.github.io/","CSS",0,0,0,0,1,"other","Other",367,0,0,2023
1409531,"PoliceBeat","jimlind/PoliceBeat",500897,"https://github.com/jimlind/PoliceBeat","Small Town Wisconsin Police Beat Repository","policebeat.info",NULL,1,1,0,0,1,NULL,NULL,NULL,0,0,2011
123744994,"populationDensity_wisconsin","Xinghom/populationDensity_wisconsin",27728775,"https://github.com/Xinghom/populationDensity_wisconsin","Visualization about population density of Wisconsin","https://xinghom.github.io/populationDensity_wisconsin/","HTML",1,1,0,0,1,NULL,NULL,107,0,0,2018
142912325,"Project-Menominee-2016","LANDIS-II-Foundation/Project-Menominee-2016",12203695,"https://github.com/LANDIS-II-Foundation/Project-Menominee-2016","Project files for the Virtual Reality at Menominee NSF-sponsored research","https://sites.google.com/a/pdx.edu/visualizing-forest-futures/home","R",0,0,1,0,1,"apache-2.0","Apache License 2.0",154,0,0,2018
384065983,"publications","zekunbillwang/publications",79238498,"https://github.com/zekunbillwang/publications","Welcome to Zekun (Bill) Wang ()`s homepage. I am currently a graduate student at the Department of Statistics at the University of WisconsinMadison. ","https://zekunbillwang.github.io/",NULL,1,1,0,0,1,"apache-2.0","Apache License 2.0",164,0,0,2021
696398414,"Rave-Ramble","nathen418/Rave-Ramble",23101313,"https://github.com/nathen418/Rave-Ramble","Developed for INFOST 490 at the University of Wisconsin Milwaukee (2023). This is a MVP, not intended for production, thrown together quickly","https://raveramble.com","PHP",1,1,0,0,1,"mit","MIT License",484,1,0,2023
77249461,"reforestation-camp-map","ryanbaumann/reforestation-camp-map",4342845,"https://github.com/ryanbaumann/reforestation-camp-map","County park trail map for Brown County, Wisconsin ","https://bl.ocks.org/ryanbaumann/raw/8fee54a62b06b872ca7ac39e1f63ddc6/a93300e9e48e9e47a4a565ef4cbb30bddf7e9034/#13/44.6667/-88.0813","CSS",1,1,0,0,1,"mit","MIT License",748,1,0,2016
695961653,"renew-wisconsin","DSSD-Madison/renew-wisconsin",116601358,"https://github.com/DSSD-Madison/renew-wisconsin","React web interface for RENEW Wisconsin`s CSB calculator.","https://renewcsbcalculator.netlify.app/","TypeScript",0,0,0,16,1,NULL,NULL,1815,0,0,2023
244801864,"SAFEwalk-mobile","mujahidfa/SAFEwalk-mobile",17759705,"https://github.com/mujahidfa/SAFEwalk-mobile","A mobile app for the University of Wisconsin`s SAFEwalk service.","https://transportation.wisc.edu/safewalk/","JavaScript",3,3,3,0,1,NULL,NULL,4071,1,0,2020
97166642,"ShinyProject","pmasiphelps/ShinyProject",22987725,"https://github.com/pmasiphelps/ShinyProject","RShiny App Visualizing Police Stops in Wisconsin from 2011-2015","https://blog.nycdatascience.com/r/wisconsin-state-police-stops-choices-madison-led-missing-racial-data-outcomes/","R",0,0,0,0,1,NULL,NULL,NULL,0,0,2017
328246113,"Slank","MelanieJindali/Slank",58493602,"https://github.com/MelanieJindali/Slank","Slank is a producer, engineer, and DJ based in Madison, Wisconsin. This site is to showcase the artist`s latest projects, collaborations and merchandise.","https://slankmusic.com","JavaScript",0,0,0,0,1,NULL,NULL,511,1,0,2021
95511504,"SpatialAnalysis","brobin665/SpatialAnalysis",21376534,"https://github.com/brobin665/SpatialAnalysis","Spatial Analysis of Cancer and Nitrates in Wisconsin","https://brobin665.github.io/SpatialAnalysis/index.html","JavaScript",0,0,0,0,1,NULL,NULL,NULL,0,0,2017
